{
  "id": "us-ap-statistics-4-inference-for-means",
  "system": "us",
  "track": "ap",
  "subject": "AP Statistics",
  "unit": "Unit 4: Inference for Quantitative Data: Means",
  "topics": [
    "sampling distributions for sample means",
    "t-intervals and t-tests for a mean or a mean difference",
    "intervals and tests for the difference of two means"
  ],
  "jp_equivalents": [
    {
      "subject": "数学B 統計的な推測",
      "coverage": "some",
      "note": "母平均の推定のみ。t 分布は日本の高校範囲外"
    }
  ],
  "term_refs": [
    "sampling-distribution",
    "t-distribution",
    "degrees-of-freedom",
    "one-sample-t-test",
    "paired-t-test",
    "two-sample-t-test",
    "confidence-interval",
    "population-mean",
    "population-standard-deviation",
    "sampling-distribution-of-the-mean",
    "standard-error",
    "sample-mean"
  ],
  "sources": [
    {
      "type": "reference",
      "title": "AP Statistics Course and Exam Description (College Board), Effective Fall 2026",
      "url": "https://apcentral.collegeboard.org/media/pdf/ap-statistics-course-and-exam-description.pdf"
    }
  ],
  "updated": "2026-09-25"
}
