{
  "id": "us-integrated-2-polynomials-and-complex",
  "system": "us",
  "track": "integrated",
  "subject": "Integrated Math 2",
  "unit": "Polynomials, radicals, and complex numbers",
  "topics": [
    "polynomial operations",
    "factoring",
    "radicals and rational exponents",
    "complex numbers"
  ],
  "jp_equivalents": [
    {
      "subject": "中3 式の展開と因数分解",
      "coverage": "full"
    },
    {
      "subject": "中3 平方根",
      "coverage": "most"
    },
    {
      "subject": "数学II 複素数と方程式",
      "coverage": "some"
    }
  ],
  "term_refs": [
    "area-model",
    "binomial",
    "coefficient",
    "combine-like-terms",
    "like-terms",
    "common-factor",
    "constant-term",
    "degree",
    "difference-of-squares",
    "distribute",
    "distributive-property",
    "expand",
    "expansion",
    "factor",
    "factoring",
    "factoring-by-grouping",
    "cross-method",
    "foil",
    "leading-coefficient",
    "monomial",
    "perfect-square-trinomial",
    "polynomial",
    "prime-polynomial",
    "quadratic-expression",
    "special-products",
    "square-of-a-binomial",
    "trinomial",
    "write-in-descending-order",
    "simplify",
    "square",
    "square-root-of-a-number",
    "principal-square-root",
    "radical-sign",
    "radical-expression",
    "simplify-radicals",
    "like-radicals",
    "rationalizing-the-denominator",
    "rational-exponent",
    "nth-root",
    "laws-of-exponents",
    "rational-number",
    "irrational-number",
    "real-number",
    "repeating-decimal",
    "terminating-decimal",
    "non-terminating-decimal",
    "approximate-value",
    "bound-estimate",
    "complex-number",
    "imaginary-unit",
    "imaginary-number",
    "pure-imaginary-number",
    "real-part",
    "imaginary-part",
    "complex-conjugate",
    "equality-of-complex-numbers",
    "square-root-of-a-negative-number"
  ],
  "sources": [
    {
      "type": "reference",
      "title": "Common Core State Standards for Mathematics, Appendix A: Designing High School Mathematics Courses"
    }
  ],
  "updated": "2026-09-25"
}
