{
  "id": "jp-chuugaku-2-renritsu-houteishiki",
  "system": "jp",
  "subject": "中2",
  "unit": "連立方程式",
  "topics": [
    "連立二元一次方程式",
    "加減法",
    "代入法",
    "連立方程式の利用"
  ],
  "us_equivalents": [
    {
      "course": "Algebra 1",
      "coverage": "full"
    },
    {
      "course": "Integrated Math 1",
      "coverage": "full"
    }
  ],
  "term_refs": [
    "system-of-linear-equations",
    "check",
    "satisfy"
  ],
  "sources": [
    {
      "type": "mext-translation",
      "doc": "中学校学習指導要領（平成29年告示）英訳版（仮訳）"
    }
  ],
  "updated": "2026-09-25"
}
