{
  "id": "us-ap-calculus-ab-5-analytical-applications",
  "system": "us",
  "track": "ap",
  "subject": "AP Calculus AB",
  "unit": "Unit 5: Analytical applications of differentiation",
  "topics": [
    "mean value theorem",
    "extreme value theorem",
    "critical points",
    "first and second derivative tests",
    "concavity",
    "curve sketching",
    "optimization"
  ],
  "jp_equivalents": [
    {
      "subject": "数学II 微分の考え",
      "coverage": "most"
    },
    {
      "subject": "数学III 微分法",
      "coverage": "full"
    }
  ],
  "term_refs": [
    "local-extremum",
    "first-derivative-test",
    "critical-point",
    "extreme-value-theorem",
    "implicit-function",
    "concavity",
    "absolute-extrema",
    "second-derivative-test",
    "candidates-test",
    "optimization-problem",
    "curve-sketching",
    "changes-sign",
    "check-the-concavity",
    "cubic-function",
    "determine-where-the-function-is-increasing-and-decreasing",
    "find-the-inflection-points",
    "find-the-local-extrema",
    "has-a-local-extremum",
    "has-a-local-maximum-at",
    "increasing-and-decreasing",
    "inflection-point",
    "is-monotonically-increasing",
    "local-maximum",
    "local-minimum",
    "make-a-sign-chart",
    "mean-value-theorem",
    "sign-chart",
    "sketch-the-graph",
    "second-derivative"
  ],
  "sources": [
    {
      "type": "reference",
      "title": "AP Calculus AB and BC Course and Exam Description (College Board)"
    }
  ],
  "updated": "2026-09-25"
}
