{
  "id": "us-algebra-2-trigonometry",
  "system": "us",
  "track": "traditional",
  "subject": "Algebra 2",
  "unit": "Trigonometric functions",
  "topics": [
    "radians",
    "unit circle",
    "graphs of sine and cosine",
    "amplitude, period, phase shift",
    "inverse trig functions",
    "basic identities"
  ],
  "jp_equivalents": [
    {
      "subject": "数学II 三角関数",
      "coverage": "most"
    },
    {
      "subject": "数学I 図形と計量",
      "coverage": "some"
    }
  ],
  "term_refs": [
    "reference-angle",
    "sine",
    "trigonometric-identities",
    "unit-circle",
    "radian-measure",
    "coterminal-angle",
    "midline",
    "sinusoid",
    "cosecant",
    "cotangent",
    "secant",
    "amplitude",
    "angle-addition-formulas",
    "area-of-a-sector",
    "clockwise",
    "compress-horizontally",
    "counterclockwise",
    "degree-measure",
    "double-angle-formulas",
    "general-angle",
    "general-solution",
    "half-angle-formulas",
    "initial-side",
    "period",
    "periodic-function",
    "phase",
    "phase-shift",
    "proving-an-identity",
    "quadrantal-angle",
    "radian",
    "stretch-vertically",
    "tangent",
    "terminal-side",
    "trigonometric-equation",
    "trigonometric-function"
  ],
  "sources": [
    {
      "type": "reference",
      "title": "Common Core State Standards for Mathematics, Appendix A: Designing High School Mathematics Courses"
    },
    {
      "type": "textbook",
      "title": "OpenStax Algebra and Trigonometry 2e"
    }
  ],
  "updated": "2026-09-27"
}
