{
  "id": "jp-suugaku-1-niji-kansuu",
  "system": "jp",
  "subject": "数学I",
  "unit": "二次関数",
  "topics": [
    "関数とグラフ",
    "二次関数のグラフ",
    "二次関数の最大・最小",
    "二次関数の決定",
    "二次方程式",
    "二次不等式",
    "グラフと x 軸の位置関係"
  ],
  "us_equivalents": [
    {
      "course": "Algebra 1",
      "coverage": "most"
    },
    {
      "course": "Algebra 2",
      "coverage": "most"
    },
    {
      "course": "Integrated Math 2",
      "coverage": "most"
    }
  ],
  "term_refs": [
    "discriminant"
  ],
  "sources": [
    {
      "type": "mext-translation",
      "doc": "高等学校学習指導要領（平成30年告示）英訳版（仮訳）"
    }
  ],
  "updated": "2026-09-24"
}
