{
  "id": "us-pre-algebra-expressions-and-equations",
  "system": "us",
  "track": "traditional",
  "subject": "Pre-Algebra",
  "unit": "Expressions and equations",
  "topics": [
    "variables and expressions",
    "evaluating expressions",
    "combining like terms",
    "distributive property",
    "one-step and two-step equations",
    "inequalities"
  ],
  "jp_equivalents": [
    {
      "subject": "中1 文字と式",
      "coverage": "full"
    },
    {
      "subject": "中1 一次方程式",
      "coverage": "most"
    }
  ],
  "term_refs": [
    "evaluate",
    "properties-of-equality",
    "check",
    "simplify",
    "work-backwards",
    "distribute",
    "order-of-operations",
    "pemdas",
    "tick-mark",
    "algebraic-expression",
    "associative-property",
    "both-sides",
    "clear-the-denominators",
    "coefficient",
    "combine-like-terms",
    "commutative-property",
    "constant",
    "constant-term",
    "distributive-property",
    "equal-sign",
    "equation",
    "expression",
    "find",
    "greater-than",
    "greater-than-or-equal-to",
    "hold",
    "inequality",
    "inequality-sign",
    "left-hand-side",
    "less-than",
    "less-than-or-equal-to",
    "let-u-equal",
    "like-terms",
    "linear-equation",
    "linear-expression",
    "move-term-to-other-side",
    "number-of-real-solutions",
    "parentheses",
    "quantity",
    "represent",
    "right-hand-side",
    "satisfy",
    "solution",
    "solve",
    "substitute",
    "term",
    "unknown",
    "value-of-the-expression",
    "variable",
    "word-problem",
    "write-an-equation"
  ],
  "sources": [
    {
      "type": "textbook",
      "title": "OpenStax Prealgebra 2e"
    }
  ],
  "updated": "2026-09-25"
}
