{
  "id": "us-algebra-2-probability-and-statistics",
  "system": "us",
  "track": "traditional",
  "subject": "Algebra 2",
  "unit": "Probability and statistics",
  "topics": [
    "permutations and combinations",
    "conditional probability",
    "binomial distribution",
    "normal distribution",
    "sampling and experiments"
  ],
  "jp_equivalents": [
    {
      "subject": "数学A 場合の数と確率",
      "coverage": "most"
    },
    {
      "subject": "数学B 統計的な推測",
      "coverage": "some"
    }
  ],
  "term_refs": [
    "sampling",
    "z-score",
    "independence-of-events",
    "error-bound",
    "counting",
    "empirical-rule",
    "observational-study",
    "experiment",
    "randomization",
    "addition-principle",
    "arithmetic-mean",
    "arrange",
    "at-least-one",
    "basic-properties-of-probability",
    "binomial-coefficient",
    "binomial-probability",
    "binomial-theorem",
    "choose",
    "circular-permutation",
    "combination",
    "complementary-event",
    "conditional-probability",
    "distinguish",
    "double-count",
    "elementary-event",
    "enumeration",
    "expected-value",
    "factorial",
    "general-addition-rule",
    "general-multiplication-rule",
    "multiplication-principle",
    "mutually-exclusive-events",
    "occur",
    "order-matters",
    "partitioning-into-groups",
    "pascals-triangle",
    "permutation",
    "permutation-of-a-multiset",
    "permutation-with-repetition",
    "repeated-trials",
    "sample-space",
    "sampling-with-replacement",
    "sampling-without-replacement",
    "simulation",
    "trial",
    "undercount",
    "union-of-events"
  ],
  "sources": [
    {
      "type": "reference",
      "title": "Common Core State Standards for Mathematics, Appendix A: Designing High School Mathematics Courses"
    }
  ],
  "updated": "2026-09-25"
}
