{
  "id": "jp-chuugaku-1-data-no-katsuyou",
  "system": "jp",
  "subject": "中1",
  "unit": "データの活用",
  "topics": [
    "度数分布表とヒストグラム",
    "相対度数・累積度数",
    "代表値と範囲",
    "統計的確率（多数回の試行）"
  ],
  "us_equivalents": [
    {
      "course": "Pre-Algebra",
      "coverage": "most"
    },
    {
      "course": "Algebra 1",
      "coverage": "some"
    }
  ],
  "term_refs": [
    "compare"
  ],
  "sources": [
    {
      "type": "mext-translation",
      "doc": "中学校学習指導要領（平成29年告示）英訳版（仮訳）"
    }
  ],
  "updated": "2026-09-11"
}
