{
  "id": "us-algebra-2-radical-functions",
  "system": "us",
  "track": "traditional",
  "subject": "Algebra 2",
  "unit": "Radical functions and rational exponents",
  "topics": [
    "nth roots",
    "rational exponents",
    "radical functions",
    "radical equations",
    "inverses"
  ],
  "jp_equivalents": [
    {
      "subject": "数学II 指数関数と対数関数",
      "coverage": "some",
      "note": "指数の拡張"
    },
    {
      "subject": "数学III 極限",
      "coverage": "some",
      "note": "無理関数"
    }
  ],
  "term_refs": [
    "radical-function",
    "rational-exponent"
  ],
  "sources": [
    {
      "type": "reference",
      "title": "Common Core State Standards for Mathematics, Appendix A: Designing High School Mathematics Courses"
    },
    {
      "type": "textbook",
      "title": "OpenStax Algebra and Trigonometry 2e"
    }
  ],
  "updated": "2026-09-11"
}
