{
  "id": "us-ap-statistics-3-inference-for-proportions",
  "system": "us",
  "track": "ap",
  "subject": "AP Statistics",
  "unit": "Unit 3: Inference for Categorical Data: Proportions",
  "topics": [
    "estimators",
    "confidence intervals for a proportion and a difference of proportions",
    "tests for a proportion and a difference of proportions",
    "p-values",
    "Type I and Type II errors, power",
    "chi-square tests for homogeneity or independence"
  ],
  "jp_equivalents": [
    {
      "subject": "数学B 統計的な推測",
      "coverage": "some",
      "note": "母比率の推定・検定のみ。2 つの比率の差とカイ二乗検定は日本の高校範囲外"
    }
  ],
  "term_refs": [
    "sampling-distribution",
    "sampling-distribution-of-a-proportion",
    "unbiased-estimator",
    "reject",
    "critical-value",
    "test-statistic",
    "p-value",
    "type-i-error",
    "type-ii-error",
    "statistically-significant",
    "two-proportion-z-test",
    "statistical-power",
    "degrees-of-freedom",
    "chi-square-test",
    "test-for-independence",
    "test-for-homogeneity",
    "expected-count",
    "observed-count",
    "confidence-interval",
    "alternative-hypothesis",
    "confidence-level",
    "error-bound",
    "estimation",
    "fail-to-reject",
    "hypothesis-testing",
    "interval-estimation",
    "is-biased",
    "null-hypothesis",
    "one-tailed-test",
    "point-estimate",
    "population-proportion",
    "sample-proportion",
    "significance-level",
    "standard-error",
    "statistical-hypothesis",
    "test",
    "two-tailed-test",
    "unbiased"
  ],
  "sources": [
    {
      "type": "reference",
      "title": "AP Statistics Course and Exam Description (College Board), Effective Fall 2026",
      "url": "https://apcentral.collegeboard.org/media/pdf/ap-statistics-course-and-exam-description.pdf"
    }
  ],
  "updated": "2026-09-25"
}
