{
  "id": "us-precalculus-trigonometry",
  "system": "us",
  "track": "traditional",
  "subject": "Precalculus",
  "unit": "Trigonometric functions",
  "topics": [
    "unit circle",
    "radian measure",
    "sine, cosine, tangent",
    "secant, cosecant, cotangent",
    "graphs and transformations",
    "inverse trigonometric functions",
    "trigonometric identities",
    "law of sines and law of cosines"
  ],
  "jp_equivalents": [
    {
      "subject": "数学I 図形と計量",
      "coverage": "some",
      "note": "三角比・正弦定理・余弦定理はここ。"
    },
    {
      "subject": "数学II 三角関数",
      "coverage": "most",
      "note": "弧度法・グラフ・加法定理はここ。sec/csc/cot と逆三角関数は日本の高校では扱わない。"
    }
  ],
  "term_refs": [
    "adjacent-side",
    "amplitude",
    "angle",
    "angle-of-depression",
    "angle-of-elevation",
    "area-of-a-sector",
    "bearing",
    "clockwise",
    "cofunction-identity",
    "cosine",
    "counterclockwise",
    "degree-measure",
    "general-angle",
    "indirect-measurement",
    "initial-side",
    "law-of-cosines",
    "law-of-sines",
    "period",
    "periodic-function",
    "phase",
    "phase-shift",
    "quadrantal-angle",
    "radian",
    "radian-measure",
    "reference-angle",
    "sine",
    "supplementary-angle-identity",
    "tangent",
    "terminal-side",
    "trigonometric-function",
    "trigonometric-identities",
    "trigonometric-ratio",
    "unit-circle"
  ],
  "updated": "2026-09-25"
}
