{
  "id": "us-precalculus-polynomial-and-rational",
  "system": "us",
  "track": "traditional",
  "subject": "Precalculus",
  "unit": "Polynomial and rational functions",
  "topics": [
    "zeros of polynomials",
    "complex zeros",
    "rational functions and asymptotes",
    "partial fractions",
    "polynomial and rational inequalities"
  ],
  "jp_equivalents": [
    {
      "subject": "数学II 複素数と方程式",
      "coverage": "most"
    },
    {
      "subject": "数学II 式と証明",
      "coverage": "some"
    },
    {
      "subject": "数学III 極限",
      "coverage": "some"
    }
  ],
  "term_refs": [
    "removable-discontinuity",
    "rational-function",
    "zeros-of-a-polynomial",
    "polynomial-inequality",
    "sign-chart-inequality",
    "test-point",
    "compare-coefficients",
    "complex-conjugate",
    "complex-fraction",
    "complex-number",
    "cubic-function",
    "decompose-into-partial-fractions",
    "denominator",
    "division-algorithm",
    "equality-of-complex-numbers",
    "find-a-common-denominator",
    "find-the-asymptotes",
    "imaginary-number",
    "imaginary-part",
    "imaginary-solution",
    "imaginary-unit",
    "intermediate-value-theorem",
    "numerator",
    "partial-fraction-decomposition",
    "polynomial-division",
    "pure-imaginary-number",
    "rational-expression",
    "real-part",
    "reduce",
    "remainder",
    "remainder-theorem",
    "sketch-the-graph",
    "square-root-of-a-negative-number",
    "substituting-values",
    "synthetic-division",
    "factor-theorem",
    "conjugate-roots"
  ],
  "sources": [
    {
      "type": "textbook",
      "title": "OpenStax Precalculus 2e"
    }
  ],
  "updated": "2026-09-27"
}
